{
  "$schema": "https://roblox-top1.local/schemas/smoke-evidence.schema.json",
  "schemaVersion": "3.0.0",
  "status": "PASS",
  "generatedAt": "2026-07-17T06:35:30.121979Z",
  "evidenceTier": "SMOKE_COMPLETE",
  "rendererTruth": "BLENDER_PREFLIGHT_ONLY_STUDIO_IS_CANONICAL",
  "territories": [
    {
      "territoryId": "industrial-toy-defense",
      "status": "PASS",
      "buildReportSha256": "c64bbd7be5788adc31c09e61d117aa9fa0d8e19e54e00b2c98361adaa8ad51bc",
      "inputHashes": {
        "territory": "376db838f206a46e114993ab5c666a155341215931069b879527666ebd144450",
        "calibration": "8a33c6c8a9b5a02ef460f5e698907a4d6d623e2f5c475047cd3dbdccc102ace9",
        "camera": "f2daf7d92ff4db38a588cb29588c5856c8894ec0c11d30d3d01c527bf7cd8d44",
        "renderMatrix": "1912f4b47aeb6064f8022bc3275b3b881cfeed39e1c3421800112c30d1b211f2",
        "lighting": "8e3db2df064ac33f79703e21aa702709a7162fa43b56d07f706e3af03647e085",
        "materials": "41fadb667eb50a2252e6721649afee1b38b98a667ea7c2051f5f465ad9896b83",
        "generator": "56595b8c3e615f19ff84d4f9e52969d9a63be0c6b48150d29173b0f4a3016880"
      },
      "expectedRenderCount": 108,
      "actualRenderCount": 108,
      "renderEvidenceComplete": true,
      "renderEvidence": [
        {
          "jobId": "mobile_semantic_smoke",
          "path": "build/industrial-toy-defense/renders/smoke/industrial-toy-defense__barricade__intact__near__Lighting_Gameplay_Default__world_neutral_light__mobile_landscape_hard__beauty.png",
          "sha256": "0a9926ba067a9b9e022c94ae42dac96893fcb56615c31cefdc6e06c33baa1f9c"
        },
        {
          "jobId": "mobile_semantic_smoke",
          "path": "build/industrial-toy-defense/renders/smoke/industrial-toy-defense__barricade__intact__near__Lighting_Gameplay_Default__world_neutral_dark__mobile_landscape_hard__beauty.png",
          "sha256": "219fc48966ca8cf6778e58574538761d458be41221d36f5262d0ea3eab96da24"
        },
        {
          "jobId": "mobile_semantic_smoke",
          "path": "build/industrial-toy-defense/renders/smoke/industrial-toy-defense__barricade__intact__near__Lighting_Adverse_Night__world_neutral_light__mobile_landscape_hard__beauty.png",
          "sha256": "a935c377901438a0a3582b97e2cd3e9f2f026c01da9ef38953f75089c39a2c01"
        },
        {
          "jobId": "mobile_semantic_smoke",
          "path": "build/industrial-toy-defense/renders/smoke/industrial-toy-defense__barricade__intact__near__Lighting_Adverse_Night__world_neutral_dark__mobile_landscape_hard__beauty.png",
          "sha256": "9a92a87d3a39ecf0bd7ae5489a1afc0a6528461d421d38e04df915907b43b1e0"
        },
        {
          "jobId": "mobile_semantic_smoke",
          "path": "build/industrial-toy-defense/renders/smoke/industrial-toy-defense__barricade__intact__mid__Lighting_Gameplay_Default__world_neutral_light__mobile_landscape_hard__beauty.png",
          "sha256": "a4aa9a64ea30b165ea1df24afbd4619bee628a11b1bc7bd79fb052e1aa1badda"
        },
        {
          "jobId": "mobile_semantic_smoke",
          "path": "build/industrial-toy-defense/renders/smoke/industrial-toy-defense__barricade__intact__mid__Lighting_Gameplay_Default__world_neutral_dark__mobile_landscape_hard__beauty.png",
          "sha256": "2c41eeaa10a5f8be6071e261b7c49fee3c232337df8ace6e880a36642eb124c3"
        },
        {
          "jobId": "mobile_semantic_smoke",
          "path": "build/industrial-toy-defense/renders/smoke/industrial-toy-defense__barricade__intact__mid__Lighting_Adverse_Night__world_neutral_light__mobile_landscape_hard__beauty.png",
          "sha256": "84b0e2ddc5e4afe985a56b3d9dc52df33f8dd0ec432f233952d82705a491791a"
        },
        {
          "jobId": "mobile_semantic_smoke",
          "path": "build/industrial-toy-defense/renders/smoke/industrial-toy-defense__barricade__intact__mid__Lighting_Adverse_Night__world_neutral_dark__mobile_landscape_hard__beauty.png",
          "sha256": "33e08391c60fd8eddeed653e5e3ee36e69cc4c40c82515bfa9ae75cc7f10521c"
        },
        {
          "jobId": "mobile_semantic_smoke",
          "path": "build/industrial-toy-defense/renders/smoke/industrial-toy-defense__barricade__intact__far__Lighting_Gameplay_Default__world_neutral_light__mobile_landscape_hard__beauty.png",
          "sha256": "dcd70710d45ed1ad6251e1d27819635af61bcea8b4546af0b6bb852a6e542914"
        },
        {
          "jobId": "mobile_semantic_smoke",
          "path": "build/industrial-toy-defense/renders/smoke/industrial-toy-defense__barricade__intact__far__Lighting_Gameplay_Default__world_neutral_dark__mobile_landscape_hard__beauty.png",
          "sha256": "fea9bc0752abe1268d294bfd74364fdc49f15d7378c4156f8349b5f081818aaf"
        },
        {
          "jobId": "mobile_semantic_smoke",
          "path": "build/industrial-toy-defense/renders/smoke/industrial-toy-defense__barricade__intact__far__Lighting_Adverse_Night__world_neutral_light__mobile_landscape_hard__beauty.png",
          "sha256": "cc660fb0998e452ab80b7415a9b49ea8a1fe711db8371eafe5190a044380f427"
        },
        {
          "jobId": "mobile_semantic_smoke",
          "path": "build/industrial-toy-defense/renders/smoke/industrial-toy-defense__barricade__intact__far__Lighting_Adverse_Night__world_neutral_dark__mobile_landscape_hard__beauty.png",
          "sha256": "f749d65883b9ac68381495f9905bb3b5e7d74ed9ec5877fcba8f002c45d417f6"
        },
        {
          "jobId": "mobile_semantic_smoke",
          "path": "build/industrial-toy-defense/renders/smoke/industrial-toy-defense__barricade__critical__near__Lighting_Gameplay_Default__world_neutral_light__mobile_landscape_hard__beauty.png",
          "sha256": "15ca8a5e64f18450b32000b3553e4b937187f19b451f648a993d24cf58992a4c"
        },
        {
          "jobId": "mobile_semantic_smoke",
          "path": "build/industrial-toy-defense/renders/smoke/industrial-toy-defense__barricade__critical__near__Lighting_Gameplay_Default__world_neutral_dark__mobile_landscape_hard__beauty.png",
          "sha256": "72cd4677acc51f6ac5a092aa72881df2f92897e8ee9f8a8fa4384864ebd47336"
        },
        {
          "jobId": "mobile_semantic_smoke",
          "path": "build/industrial-toy-defense/renders/smoke/industrial-toy-defense__barricade__critical__near__Lighting_Adverse_Night__world_neutral_light__mobile_landscape_hard__beauty.png",
          "sha256": "017917c0501b21fc2257384f99cdf0789f1e839550033e064eadef7d6458dbc1"
        },
        {
          "jobId": "mobile_semantic_smoke",
          "path": "build/industrial-toy-defense/renders/smoke/industrial-toy-defense__barricade__critical__near__Lighting_Adverse_Night__world_neutral_dark__mobile_landscape_hard__beauty.png",
          "sha256": "0d9403d10ce2efbe25a4de06ff92c041a80edca157475254fb60831e94e569b4"
        },
        {
          "jobId": "mobile_semantic_smoke",
          "path": "build/industrial-toy-defense/renders/smoke/industrial-toy-defense__barricade__critical__mid__Lighting_Gameplay_Default__world_neutral_light__mobile_landscape_hard__beauty.png",
          "sha256": "28a30021f543cdbbc0065fb2173741107498bab84f8400ede2f36ac4ff407c14"
        },
        {
          "jobId": "mobile_semantic_smoke",
          "path": "build/industrial-toy-defense/renders/smoke/industrial-toy-defense__barricade__critical__mid__Lighting_Gameplay_Default__world_neutral_dark__mobile_landscape_hard__beauty.png",
          "sha256": "207b90df8947948554569cb7a2abf41cd33065f96ed60b57ce4dcd9b555c9b0c"
        },
        {
          "jobId": "mobile_semantic_smoke",
          "path": "build/industrial-toy-defense/renders/smoke/industrial-toy-defense__barricade__critical__mid__Lighting_Adverse_Night__world_neutral_light__mobile_landscape_hard__beauty.png",
          "sha256": "25e22fcc5f69e900b9790db25dd11a4de14ce5fc8df654c7e659f09885ef22ee"
        },
        {
          "jobId": "mobile_semantic_smoke",
          "path": "build/industrial-toy-defense/renders/smoke/industrial-toy-defense__barricade__critical__mid__Lighting_Adverse_Night__world_neutral_dark__mobile_landscape_hard__beauty.png",
          "sha256": "0bf6c2f2bec0abdc4030208e2f5de72281356c9a6608c88beea758ccc19cea62"
        },
        {
          "jobId": "mobile_semantic_smoke",
          "path": "build/industrial-toy-defense/renders/smoke/industrial-toy-defense__barricade__critical__far__Lighting_Gameplay_Default__world_neutral_light__mobile_landscape_hard__beauty.png",
          "sha256": "a8c1090a9f0775849551a3147b914a8e66962c1fa74f136c9fc84a481d2f5126"
        },
        {
          "jobId": "mobile_semantic_smoke",
          "path": "build/industrial-toy-defense/renders/smoke/industrial-toy-defense__barricade__critical__far__Lighting_Gameplay_Default__world_neutral_dark__mobile_landscape_hard__beauty.png",
          "sha256": "f1c107db582b34a8824612ec43dfd744427f4662097d2b65d6ee5f881eb491b2"
        },
        {
          "jobId": "mobile_semantic_smoke",
          "path": "build/industrial-toy-defense/renders/smoke/industrial-toy-defense__barricade__critical__far__Lighting_Adverse_Night__world_neutral_light__mobile_landscape_hard__beauty.png",
          "sha256": "dddd49fda8df84e9d744e4cf3ce6da7361014339b54cb4575a3ad46075a40948"
        },
        {
          "jobId": "mobile_semantic_smoke",
          "path": "build/industrial-toy-defense/renders/smoke/industrial-toy-defense__barricade__critical__far__Lighting_Adverse_Night__world_neutral_dark__mobile_landscape_hard__beauty.png",
          "sha256": "0db483ac0404da2a3f358bbd8b911e6378f6ae221a8d21ac843a7702db05b0e6"
        },
        {
          "jobId": "mobile_semantic_smoke",
          "path": "build/industrial-toy-defense/renders/smoke/industrial-toy-defense__objective_core__intact__near__Lighting_Gameplay_Default__world_neutral_light__mobile_landscape_hard__beauty.png",
          "sha256": "cf2dc008a0e5d95cca76686e5a2aef9a0913ae0b8c57a500a560b809a7ba595a"
        },
        {
          "jobId": "mobile_semantic_smoke",